id_,created_at,tweetID,tweet,username,id_str,name,entity,commentcount,likes,retweets,quotes,replies,sentiment,bidang,gender,link,imageUrl
1693,March-24,1.77192E+18,bisa bisanya ada mobil toyota agya cuma rp 1 ?cuma ada di shopee live spesial Promo Big Ramadan Sale MALAM INI JAM 8 MALAM! Gila sih langsung klik di sini: https://shope.ee/6AGxobgm7H #MobilAgya...,syifaarhmh,1.01484E+18,sipaaaa,Toyota,0,32719,481,38369,0,NULL,NULL,NULL,https://twitter.com/syifaarhmh/status/1771920007930548505,https://pbs.twimg.com/media/GJcf1zvacAACNoN.jpg:large
1690,March-24,1.77192E+18,bayangin dulu dapet mobil toyota calya? pokoknya usaha dulu stay di shopee live spesial Promo Big Ramadan Sale MALAM INI JAM 8 MALAM! Set reminder di sini: https://shope.ee/6AGxobgm7H #MobilAgya...,nputripe,1023399601,Puput,Toyota,0,29456,721,37211,0,NULL,NULL,NULL,https://twitter.com/nputripe/status/1771920446310781353,https://pbs.twimg.com/media/GJcgQQJaQAAMwqV.jpg:large
1698,March-24,1.77201E+18,"GR Garage tak cuma layani pasang aksesori resmi, terima servis reguler mobil Toyota. #kumparanOTO",kumparan,7.59693E+17,kumparan,Toyota,0,1076361,3,1062440,0,NULL,NULL,NULL,https://twitter.com/kumparan/status/1772005862007263342,https://pbs.twimg.com/profile_images/1767045557586157568/7J5cUyvT_200x200.jpg
1694,March-24,1.77205E+18,"udah pada tahu dong kalo bakalan ada mobil toyota agya, honda brio, motor yamaha nmax seharga 1 rupiah! jangan lewatkan deh hari ini 25 maret di shopee live dan tv kesayanganmu mulai jam 20.00...",reimaits,2944720706,RM.,Toyota,0,21945,52,1297,0,NULL,NULL,NULL,https://twitter.com/reimaits/status/1772048248792035775,https://pbs.twimg.com/media/GJeLycRbcAAWtsY.jpg:large
1697,March-24,1.77205E+18,"siapa sih yg gamau banget dapetin mobil toyota agya, honda brio, motor yamaha nmax seharga 1 rupiah! pokoknya aku siap buat nonton shopee live dan tv kesayangan mulai jam 20.00 wib 25 maret!...",luvmatchha,3009993750,Gemini Girl,Toyota,0,11418,1637,4554,0,NULL,NULL,NULL,https://twitter.com/luvmatchha/status/1772048248888287527,https://pbs.twimg.com/media/GJeJ0vmbgAABz1q.jpg:large
1081,March-24,1.77208E+18,"Square profile picture · Official Suzuki Indonesia · @SuzukiIndonesia. ·. Mar 3. Cara merawat eksterior mobil biar tetap glowing, bikin orang melting! ✨ kiim (@gabrielcoy59) on X Manchunian | Manchester united suporter in indonesia | #GGMU |",gabrielcoy59,2238363956,kiim,Suzuki,NULL,NULL,NULL,NULL,19,NULL,NULL,NULL,https://twitter.com/gabrielcoy59,https://pbs.twimg.com/profile_images/809370697659092992/zACGlebJ_200x200.jpg
960,March-24,1.77209E+18,"Bergerah² menunggu. Sejak covid melanda, keterusan sampai sekarang model pelayanan seperti ini. Ngantri diluar. @bankmandiri",ukyo9999999,1443807948,Ukyo Tachibana,Toyota,1,NULL,NULL,NULL,1,NULL,NULL,NULL,https://twitter.com/ukyo9999999,https://pbs.twimg.com/media/GJe5nvvaEAA0jXi.jpg:large
1711,March-24,1.7721E+18,"Sobat Shopee, NANTIKAN Flash Sale Rp1 MOBIL HONDA BRIO, TOYOTA AGYA, & MOTOR YAMAHA NMAX bersam Raffi Ahmad ? Tanggal 25 Maret, MALAM INI mulai pukul 20:00 WIB HANYA di Shopee LIVE & TV...",ShopeeID,2983890506,Shopee Indonesia,Honda,5,937329,7,2138589,5,NULL,NULL,NULL,https://twitter.com/ShopeeID/status/1772096075895095407,https://pbs.twimg.com/ext_tw_video_thumb/1771881859305324544/pu/img/3xH2rT1KGLfBjflO.jpg:large
1692,March-24,1.77212E+18,"ada kabar baik nih, kita bisa dapetin mobil toyota agya, honda brio sama motor yamaha nmax seharga 1 rupiah ajaa! jangan sampe kelewatan nonton #ShopeeLiveMobilBrioRp1 di shopee live dan tv...",cimotyy,1.09961E+18,Fanny,Toyota,515,47979,3208,184039,515,NULL,NULL,NULL,https://twitter.com/cimotyy/status/1772123850731307333,https://pbs.twimg.com/media/GJfZPbjbEAEnK2v.jpg:large
1696,March-24,1.77212E+18,"gilasih #ShopeeLiveMobilBrioRp1 bagi bagi hadiah, ada Mobil Toyota Agya, honda brio, Motor Yamaha Nmax seharga 1 RUPIAH! Cuman di 25 Maret shopee live dan TV kesayanganmu mulai jam 20.00 WIB...",yodisss,1.31492E+18,diss,Toyota,287,36896,486,38803,287,NULL,NULL,NULL,https://twitter.com/yodisss/status/1772124845913911310,https://pbs.twimg.com/media/GJfaJqtaEAA4ojf.jpg:large
1713,March-24,1.77213E+18,Info yang punya mobil honda freed warna putih dong mau buat syuting habis lebaran di JogjaTranslate post,Fandy_BA,516362086,Fandy Bayu Aditya,Honda,1,582,551,54504,1,NULL,NULL,NULL,https://twitter.com/Fandy_BA/status/1772128444375286139,https://pbs.twimg.com/profile_images/1227779265430581248/kzI6p5IX_200x200.jpg
1712,March-24,1.77217E+18,"Pengemudi mobil Honda Accord mengalami kecelakaan tunggal di Jalan Pajajaran, Kota Bogor. Korban, wanita berinisial W (22) mengalami sesak napas hingga mobilnya menabrak median jalan. BEL Selengkap...",officialinews_,132078023,iNews,Honda,0,431104,0,189059,0,NULL,NULL,NULL,https://twitter.com/officialinews_/status/1772170461377622444,https://pbs.twimg.com/media/GJgDoG7akAAAMRf.jpg:large
1714,March-24,1.77217E+18,"MALAM INI mulai pukul 20.00 WIB akan ada Flash Sale RP1 Mobil Honda Brio, Mobil Toyota Agya, Motor Yamaha NMax bersama Raffi Ahmad di Shopee Live & TV kesayangan kamu! ? Pasang pengingat...",ShopeeID,2983890506,Shopee Indonesia,Honda,6,938012,7,2138844,6,NULL,NULL,NULL,https://twitter.com/ShopeeID/status/1772171568631661032,https://pbs.twimg.com/ext_tw_video_thumb/1772111850601435136/pu/img/39lcU4K1c0i6r6VY.jpg:large
1704,March-24,1.77219E+18,gak bakalan nolak nih untuk bisa mendapatkan mobil toyota agya dan hadiah lain nya ingat tanggal 25 maret ada yg spesial nih #ShopeeLiveMobilBrioRp1 mulai jam 20:00 jangan sampai terlewatkan...,Pink1Diana,1.5999E+18,Diana Pink1,Toyota,0,13107,136,990,0,NULL,NULL,NULL,https://twitter.com/Pink1Diana/status/1772194251448926350,https://pbs.twimg.com/media/GJgZRUnakAA_w8-.jpg:large
1716,March-24,1.77224E+18,"Yuk, rasakan kenyamanan & kemudahan mobil listrik Wuling Air ev yang easy ini! Test drive & miliki sekarang dengan klik http://bit.ly/KONSULTASIPEMBELIANWULING_TW…! #WulingMotors #DriveForABetter...",WulingMotorsID,7.57798E+17,WulingMotorsID,Wuling,0,36361,204,12291,0,NULL,NULL,NULL,https://twitter.com/WulingMotorsID/status/1772238865970938344,https://pbs.twimg.com/profile_images/1539128369698177028/ALzAgMqw_200x200.jpg
1706,March-24,1.77225E+18,"9h. kapan lagi sih guys bisa dapetin #ShopeeLiveMobilBrioRp1? ada mobil toyota agya, motor yamaha nmax seharga rp1 juga nih! jangan kelewatan harus nonton (@) on X Absen dulu yang udah siap ikutan  Flash Sale #ShopeeLiveMobilBrioRp1 ???",AksaraDewi90734,1.72061E+18,Dewi Aksara,Toyota,NULL,NULL,NULL,NULL,1710,NULL,NULL,NULL,https://twitter.com/AksaraDewi90734,undefined:large
1027,March-24,1.77228E+18,"Kurus Bukan Berarti Susah makan, Kalu bayi Iya Biasanya Kurus karena Susah makan wkwkwkwk",rinasakila92,7.52384E+17,nisrina,Wuling,0,NULL,NULL,NULL,2492,NULL,NULL,NULL,https://twitter.com/rinasakila92,https://pbs.twimg.com/profile_images/1774404292423946240/n2ZVIBnV_200x200.jpg
953,March-24,1.77228E+18,Semoga pajaknya bermanfaat lah ya,fadhil_rasyadi,278520169,Fadhil R,Honda,1,NULL,NULL,NULL,1,NULL,NULL,NULL,https://twitter.com/fadhil_rasyadi,https://pbs.twimg.com/profile_images/1158360582002634752/b8FeZSBM_200x200.jpg
1705,March-24,1.77229E+18,"Mantep banget ada #ShopeeLiveMobilBrioRp1 juga ada Mobil Toyota Agya, honda brio, Motor Yamaha Nmax seharga 1 RUPIAH! Nantikan 25 Maret shopee live dan TV kesayanganmu mulai jam 20.00 WIB di...",iamntrovert,1.26977E+18,Introvert,Toyota,0,11306,37,8891,0,NULL,NULL,NULL,https://twitter.com/iamntrovert/status/1772289952035877067,https://pbs.twimg.com/media/GJhwT8ga8AAtCxo.jpg:large
1708,March-24,1.77242E+18,Sepeda motor korban menabrak bagian belakang mobil Daihatsu Granmax yang mengerem mendadak.Translate post,kompascom,23343960,Kompas.com,Daihatsu,0,8621909,29,2509020,0,NULL,NULL,NULL,https://twitter.com/kompascom/status/1772415813942927706,https://pbs.twimg.com/profile_images/1577144849437888514/d9x3nKN8_200x200.jpg
1703,March-24,1.77248E+18,"Hai @inguskumeler @rioagustio_ @brgtsh @kireifeline @adevavade . Selamat, kamu terpilih sebagai pemenang AUTO Quiz All New Yaris Cross HEV. Mohon melakukan konfirmasi dengan mengirim pesan...",ToyotaID,64310527,Toyota Indonesia,Toyota,4,182698,18756,50804,4,NULL,NULL,NULL,https://twitter.com/ToyotaID/status/1772476479139451310,https://pbs.twimg.com/profile_images/1558677773090439168/G0L9IPeC_200x200.jpg
1717,March-24,1.77251E+18,"PALEMBANG, http://PALTV.CO.ID - Kecelakaan lalu lintas beruntun antara sebuah mobil Toyota Innova Reborn dengan tiga sepeda motor terjadi di Jalan Demang Lebar Daun, tepatnya di depan Penerbit...",PALTV_42,3779819294,PALTV - Memang Punyo Kito,Toyota,0,468,6,1701,0,NULL,NULL,NULL,https://twitter.com/PALTV_42/status/1772507456712667154,https://pbs.twimg.com/profile_images/1653996510382784513/HfLQ4jv-_200x200.jpg
1726,March-24,1.77252E+18,"? TW / Kekerasan udh pd liat blm? menurut kalian yg salah siapa?? Mobil suzuki swiftnya nyolot bgt, kyknya yg nyetir bocil gksih?????? mobilnya ancur bgt kacanyaTranslate post",tanyakanrl,1.33165E+18,Tanyarl ?,Suzuki,3,2086596,18106,1157063,3,NULL,NULL,NULL,https://twitter.com/tanyakanrl/status/1772520043739504803,https://pbs.twimg.com/media/GJlBlVDbAAAl6lp.jpg:large
1718,March-24,1.77253E+18,"Cek Harga Mobil Bekas Toyota Sienta Tahun 2018 per Maret 2024, Cocok untuk MudikTranslate post",TribunJualBeli,1101220231,TribunJualBeli,Toyota,0,4145,680,95148,0,NULL,NULL,NULL,https://twitter.com/TribunJualBeli/status/1772528175148659041,https://pbs.twimg.com/profile_images/1388091851228340225/8WJRtx9T_200x200.png
1720,March-24,1.77254E+18,Polsek Kelapa Evakuasi Laka Lantas Di Desa Kacung Kecelakaan lalu lintas ini di alami oleh Sepeda Motor Yamaha Xeon warna Biru dengan Mobil Daihatsu Granmax Blindvan warna Putih serta mobil...,BabarPolres,8.9043E+17,Humas Polres Bangka Barat,Daihatsu,0,379,203,20134,0,NULL,NULL,NULL,https://mobile.twitter.com/BabarPolres/status/1772535408372363700,https://pbs.twimg.com/media/GJlPiVOaMAA-z5E.jpg:large
1727,March-24,1.77258E+18,Pelaku Penggelapan Mobil Mitsubishi Xpander Diciduk PolisiTranslate post,MempawahSatu,8.2998E+17,MEMPAWAH SATU ID,Mitsubishi,0,45,8,3222,0,NULL,NULL,NULL,https://twitter.com/MempawahSatu/status/1772577879966290101,https://pbs.twimg.com/profile_images/1196688627620696067/Y1xwmsxG_200x200.jpg
1725,March-24,1.77258E+18,Penyebab mata terasa berat saat nyetir di bulan Ramadan! THREAD #Suzuki #SuzukiIndonesia #SuzukiTeManBerkendara #YourGearTranslate post,SuzukiIndonesia,214823582,Official Suzuki Indonesia,Suzuki,1,56313,35,34594,1,NULL,NULL,NULL,https://twitter.com/SuzukiIndonesia/status/1772581206741426645,https://pbs.twimg.com/media/GJlhN7pawAA9u3M.jpg:large
1724,March-24,1.77258E+18,"Faktor yang lainnya, mungkin karena sahurnya belum kena kopi bikinan istri?Translate post",SuzukiIndonesia,214823582,Official Suzuki Indonesia,Suzuki,0,56301,35,34594,0,NULL,NULL,NULL,https://twitter.com/SuzukiIndonesia/status/1772581215347818824,https://pbs.twimg.com/profile_images/1670997078397558784/H9lEhaOq_200x200.jpg
1723,March-24,1.7726E+18,Rule #1 ketika nyetir pas jam pulang kantor di bulan Ramadan: *Jangan emosi* *Jangan emosi* *Jangan emosi* *Jangan emosi* *Jangan emosi* *Jangan emosi* #Suzuki #SuzukiIndonesia #SuzukiTeManBerkenda...,SuzukiIndonesia,214823582,Official Suzuki Indonesia,Suzuki,0,56301,35,34594,0,NULL,NULL,NULL,https://twitter.com/SuzukiIndonesia/status/1772604927564480817,https://pbs.twimg.com/profile_images/1670997078397558784/H9lEhaOq_200x200.jpg
1719,March-24,1.77263E+18,"Daftar Harga Mobil Daihatsu Ayla Terbaru Maret 2024, Cek di Sini!",otosia,117686358,Otosia,Daihatsu,0,20716,72,111981,0,NULL,NULL,NULL,https://twitter.com/otosia/status/1772630361899782343,https://pbs.twimg.com/profile_images/1737640462323007488/UWB34lxg_200x200.jpg
1721,March-24,1.77282E+18,"Sapi milik warga Desa Bendosewu, Kecamatan Talun Kabupaten Blitar hilang dicuri. Pencuri itu diduga menggunakan mobil Daihatsu Gran Max untuk angkut sapi?Translate post",detikcom,69183155,detikcom,Daihatsu,1,21837955,42,2331128,1,NULL,NULL,NULL,https://twitter.com/detikcom/status/1772815132571390408,https://pbs.twimg.com/profile_images/1683699442195779585/RiZF3LYN_200x200.jpg
1722,March-24,1.77282E+18,"Berdasarkan video dan foto di media sosial, truk yang membawa furnitur dan truk berukuran sedang terguling. Airbag mobil Hyundai juga pecah.Translate post",kompascom,23343960,Kompas.com,Hyundai,0,8622454,29,2509962,0,NULL,NULL,NULL,https://twitter.com/kompascom/status/1772816863439057155,https://pbs.twimg.com/profile_images/1577144849437888514/d9x3nKN8_200x200.jpg
1732,March-24,1.77284E+18,"Lima mobil terlibat kecelakaan beruntun di Tol Halim Utama dari arah Bekasi ke Tol Dalam Kota, Jakarta Timur, Rabu (27/3/2024). Traffic Management Center Polda Metro Jaya mengatakan tak ada...",NarasiNewsroom,1.15836E+18,Narasi Newsroom,Hyundai,0,245667,7,22022,0,NULL,NULL,NULL,https://twitter.com/NarasiNewsroom/status/1772838539316940906,https://pbs.twimg.com/amplify_video_thumb/1772838523437264896/img/jKe_W6yh8MPXwYU1.jpg:large
1733,March-24,1.77291E+18,"?Beredar sebuah video momen sebelum kejadian kecelakaan beruntun di Gerbang Tol (GT) Halim Utama, Jakarta Timur, Rabu (27/3/2024) pagi. Sopir berinisial MI (18) terlihat menabrak sebuah...",inilahdotcom,46693036,inilahcom,Mitsubishi,1,366253,50,97283,1,NULL,NULL,NULL,https://twitter.com/inilahdotcom/status/1772907867437203881,https://pbs.twimg.com/ext_tw_video_thumb/1772907806485786624/pu/img/lMr55f1avqNuY9w2.jpg:large
1735,March-24,1.77291E+18,Karena kelakuan driver-driver kaya merekalah yang bikin gua males beli mobil-mobil Mitsubishi. Selain karena emang duitnya belum ada.Translate post,fdly_aahmd,1.5044E+18,Fadli Ahmad,Mitsubishi,0,269,166,5962,0,NULL,NULL,NULL,https://twitter.com/fdly_aahmd/status/1772908711054541194,https://pbs.twimg.com/profile_images/1504402475209482242/LuTEwefN_200x200.jpg
1737,March-24,1.77292E+18,Kini giliran kamu rasakan #BinguoMoment bersama mobil listrik Wuling BinguoEV dengan Test Drive sekarang di http://bit.ly/TESTDRIVEWULING_TW…! #WulingMotors #DriveForABetterLife #BinguoEV...,WulingMotorsID,7.57798E+17,WulingMotorsID,Wuling,0,36379,203,12359,0,NULL,NULL,NULL,https://twitter.com/WulingMotorsID/status/1772918840004903113,https://pbs.twimg.com/profile_images/1539128369698177028/ALzAgMqw_200x200.jpg
1734,March-24,1.77293E+18,Truk merah yang dikemudikan pria berusia 18 tahun itu diketahui terlibat senggolan dengan mobil Mitsubishi Xpander Cross dan Honda Brio.Translate post,kompascom,23343960,Kompas.com,Mitsubishi,0,8633834,29,2537896,0,NULL,NULL,NULL,https://twitter.com/kompascom/status/1772929088497594451,https://pbs.twimg.com/profile_images/1577144849437888514/d9x3nKN8_200x200.jpg
1736,March-24,1.77299E+18,"Daftar Harga Mobil Wuling Almaz RS Pro Hybrid, Lengkap dengan Spesifikasinya",otosia,117686358,Otosia,Wuling,0,20716,72,111983,0,NULL,NULL,NULL,https://twitter.com/otosia/status/1772990852484481204,https://pbs.twimg.com/profile_images/1737640462323007488/UWB34lxg_200x200.jpg
1730,March-24,1.77309E+18,Presiden Direktur Honda Indonesia yang baru janji bakal bawa mobil hybrid baru.Translate post,kumparan,7.59693E+17,kumparan,Honda,0,1079422,3,1076459,0,NULL,NULL,NULL,https://twitter.com/kumparan/status/1773093531898511481,https://pbs.twimg.com/profile_images/1777904276129624064/YWurU1PS_200x200.jpg
247,March-24,1.7731E+18,Lihat video Bayu hutama motor! #TikTok,bayu_motor,1318903056,Bayu hutama motor,Suzuki,0,NULL,NULL,NULL,0,NULL,NULL,NULL,https://twitter.com/bayu_motor,https://pbs.twimg.com/profile_images/3457600321/45a93235edf6a3c86623133990410a6d_200x200.jpeg
1731,March-24,1.77312E+18,"Dalam hati: ""Ini opini gue keren banget nih. Ayo mana lo lo buzzer transum! Tantang fakta yang gue kasih nih!""Translate post",arvidisini,41948422,Arfiadi Pratama,Honda,1,774,823,28494,1,NULL,NULL,NULL,https://twitter.com/arvidisini/status/1773124509236678934,https://pbs.twimg.com/tweet_video_thumb/GJtnVk8aoAAY4Se.jpg:large
1739,March-24,1.77315E+18,"Hi, #HyundaiLovers! Interior pada IONIQ 6 dirancang menggunakan bahan yang ramah lingkungan secara inovatif, pemanfaatan material yang ramah lingkungan, mempertegas IONIQ 6 sebagai mobil listrik...",hyundaimobil,160138881,Hyundai Indonesia,Hyundai,0,12630,96,7020,0,NULL,NULL,NULL,https://twitter.com/hyundaimobil/status/1773152337923555784,https://pbs.twimg.com/media/GJuAh8fawAAVpNu.jpg:large
1728,March-24,1.77319E+18,"Truk Tabrak Avanza di Madiun, Warga Ponorogo Meninggal. ? Truk logistik nopol L 8774 UU terlibat kecelakaan dengan mobil Toyota Avanza di Jalan Raya Madiun-Surabaya, masuk Desa Garon, Kecamatan...",beritajatimcom,21287066,beritajatim,Toyota,0,27204,337,477351,0,NULL,NULL,NULL,https://twitter.com/beritajatimcom/status/1773192174102044713,https://pbs.twimg.com/profile_images/1383296141022810119/hvPUhWiS_200x200.jpg
1740,March-24,1.7732E+18,"? Kecelakaan Gerbang Tol Halim Utama Sopir truk yang menyebabkan kecelakaan beruntun di Gerbang Tol Halim Utama pada Rabu (27/3/2024), M. Isnem (18), menyatakan siap bertanggung jawab dengan...",hariankompas,255866913,Harian Kompas,Hyundai,4,1049613,274,332420,4,NULL,NULL,NULL,https://twitter.com/hariankompas/status/1773202831182635418,https://pbs.twimg.com/media/GJuuP-vbEAAMFeI.jpg:large
1743,March-24,1.77321E+18,Pelaku Penggelapan Mobil Mitsubishi Xpander Bengong Saat di Ciduk Polisi https://bhabinkamtibmaskmb.blogspot.com/2024/03/pelaku-penggelapan-mobil-mitsubishi.html…Translate post,KMBPOLSEK,1.61011E+18,Polsek Kuala Mandor B,Mitsubishi,0,1,8,2068,0,NULL,NULL,NULL,https://twitter.com/KMBPOLSEK/status/1773210789953806758,https://pbs.twimg.com/media/GJu1ywFaAAA0eg8.jpg:large
1742,March-24,1.7733E+18,(((Cerita di balik tradisi mudik di Indonesia))) THREAD #Suzuki #SuzukiIndonesia #SuzukiTeManBerkendara #YourGearTranslate post,SuzukiIndonesia,214823582,Official Suzuki Indonesia,Suzuki,1,56320,35,34623,1,NULL,NULL,NULL,https://twitter.com/SuzukiIndonesia/status/1773301557313888597,https://pbs.twimg.com/profile_images/1670997078397558784/H9lEhaOq_200x200.jpg
1738,March-24,1.77337E+18,"Bos Honda Ngaku Tak Kaget Penjualan Mobil RI Drop, Begini AlasannyaTranslate post",cnbcindonesia,8.47373E+17,CNBC Indonesia,Honda,0,207426,36,382651,0,NULL,NULL,NULL,https://twitter.com/cnbcindonesia/status/1773370152278516001,https://pbs.twimg.com/profile_images/1268802866568806401/nqL8otRC_200x200.jpg
1741,March-24,1.77353E+18,Selamat Memperingati Jumat Agung bagi yang merayakan. ✨ Semoga cinta kasih dari Tuhan menyertaimu di Jumat yang Agung ini. #Suzuki #SuzukiIndonesia #SuzukiTeManBerkendara #YourGearTranslate post,SuzukiIndonesia,214823582,Official Suzuki Indonesia,Suzuki,1,56323,35,34611,1,NULL,NULL,NULL,https://twitter.com/SuzukiIndonesia/status/1773530517994135588,https://pbs.twimg.com/ext_tw_video_thumb/1773437184215011328/pu/img/wsp-tsZJOZnsIItA.jpg:large
1775,March-24,1.77358E+18,Teman-teman mau curhat banyak. Ngelaporin kasus pencurian #curanmor mobil suamiku ke 2 polsek di Jkt. Nihil. Padahal ada satu pelaku yang disandera suami. Tapi gak bisa dijadikan barang bukti?...,siginautami_,1.61244E+18,siginautami,Suzuki,12,NULL,NULL,NULL,12,NULL,NULL,NULL,https://twitter.com/siginautami_,undefined:large
897,March-24,1.77367E+18,Kopi jago enak jg mayan,fndrmjd,77448763,Adifa,Mitsubishi,1,NULL,NULL,NULL,1,NULL,NULL,NULL,https://twitter.com/fndrmjd,undefined:large
1745,March-24,1.77368E+18,Mudik punya dampak positif? Simak infonya di-thread ini! THREAD #Suzuki #SuzukiIndonesia #SuzukiTeManBerkendara #YourGearTranslate post,SuzukiIndonesia,214823582,Official Suzuki Indonesia,Suzuki,2,56328,35,34634,2,NULL,NULL,NULL,https://twitter.com/SuzukiIndonesia/status/1773675703327670471,https://pbs.twimg.com/profile_images/1670997078397558784/H9lEhaOq_200x200.jpg
1746,March-24,1.77368E+18,"Memberikan rasa kebahagiaan dan kenangan indah~ Momen bersama yang penuh tawa, cerita, dan kebersamaan saat mudik akan menjadi bagian dari memori yang berharga sepanjang hidup.Translate post",SuzukiIndonesia,214823582,Official Suzuki Indonesia,Suzuki,0,56339,35,34611,0,NULL,NULL,NULL,https://twitter.com/SuzukiIndonesia/status/1773675711443742984,https://pbs.twimg.com/profile_images/1670997078397558784/H9lEhaOq_200x200.jpg
932,March-24,1.77368E+18, dugong terdampar (@yonskyi) on X nama gue aslinya tyon,yonskyi,377915854,dugong terdampar,Hyundai,0,NULL,NULL,NULL,0,NULL,NULL,NULL,https://twitter.com/yonskyi,https://pbs.twimg.com/profile_images/1331183617607835648/aTa8eyIr_200x200.jpg
1606,March-24,1.77371E+18,????? ??? ??????? ????? Pilihan Paket Kredit 1.Dp mulai Rp 34 Jutaan atau 2.Cicilan mulai Rp 5 Jutaan 3.Bunga mulai https://mitsubishisur...,BelimobilID,1.21597E+18,Beli Mobil Surabaya,Wuling,0,NULL,NULL,NULL,0,NULL,NULL,NULL,https://mobile.twitter.com/BelimobilID,https://pbs.twimg.com/profile_images/1772456572498972672/_Igfj0ox_200x200.jpg
1747,March-24,1.77382E+18,"Apabila sudah ada perintah, Suzuki Indonesia mengaku pasti akan memanggil konsumen terkait.Translate post",kompascom,23343960,Kompas.com,Suzuki,0,8623568,29,2511906,0,NULL,NULL,NULL,https://twitter.com/kompascom/status/1773818557236961449,https://pbs.twimg.com/profile_images/1577144849437888514/d9x3nKN8_200x200.jpg
1748,March-24,1.77388E+18,Lowongan kerja PT Cinta Damai Putra Bahagia CirebonTranslate post,LokerCirebon,375425873,Loker Cirebon,Suzuki,0,24267,4,49018,0,NULL,NULL,NULL,https://twitter.com/LokerCirebon/status/1773882792960766081,https://pbs.twimg.com/profile_images/1508786195329056779/FbQKilJ1_200x200.jpg
1018,March-24,1.77389E+18,"Tumben banteng mlempem? Gak heran di Bali suaranya ambyar… Btw mba Puan, gimana kabar suaminya?",idwnta,430530810,Gung Rama,Mitsubishi,0,NULL,NULL,NULL,0,NULL,NULL,NULL,https://twitter.com/@idwnta,https://pbs.twimg.com/profile_images/1345668803351379969/E-LVoA2P_200x200.jpg
844,March-24,1.7739E+18,Semua yang terbukti bersalah harus disita hartanya dan digunakan untuk perbaikan lingkungan... ? Peran Kunci Suami Sandra Dewi dalam Korupsi Timah Terbongkar! Ada Tambang Ilegal,hermanto_oks,182245761,Hermanto,Toyota,0,NULL,NULL,NULL,25,NULL,NULL,NULL,https://twitter.com/hermanto_oks,https://pbs.twimg.com/profile_images/3740141820/80ce52af5541cadfa6bc6fe7e46777f3_200x200.jpeg
1744,March-24,1.77393E+18,"11.19: RT @TMCPoldaMetro : Kecelakaan antara Mikrolet dan Mobil Toyota di Jl. Raya Palmariem Matraman dekat Pasar Palmariem di Jakarta Timur, saat ini sudah di tangani petugas laka lantas Jaktim,...",RadioElshinta,121640063,Radio Elshinta,Toyota,0,3692979,11,1470480,0,NULL,NULL,NULL,https://twitter.com/RadioElshinta/status/1773928008883315122,https://pbs.twimg.com/media/GJ4-9NNbEAASzR-.jpg:large
1749,March-24,1.77393E+18,"11.06 Kecelakaan antara Mikrolet dan Mobil Toyota di Jl. Raya Palmariem Matraman dekat Pasar Palmariem di Jakarta Timur saat ini sydah di tangani petugas laka lantas Jaktim, lalu lintas tersendatTr...",TMCPoldaMetro,76647722,TMC Polda Metro Jaya,Toyota,0,8142140,1,625172,0,NULL,NULL,NULL,https://twitter.com/TMCPoldaMetro/status/1773929425035477333,https://pbs.twimg.com/media/GJ5DZHna4AAqvg2.jpg:large
1751,March-24,1.77402E+18,Ini yang bisa angkut koper kamu dan keluarga buat mudik seminggu full! #Suzuki #SuzukiIndonesia #SuzukiTeManBerkendara #YourGearTranslate post,SuzukiIndonesia,214823582,Official Suzuki Indonesia,Suzuki,1,56323,35,34618,1,NULL,NULL,NULL,https://twitter.com/SuzukiIndonesia/status/1774019575157559303,https://pbs.twimg.com/media/GJ6VZhGa0AAjbLl.jpg:large
1758,March-24,1.77403E+18,Agatha Pricilla nyaman bergantung pada mobil Mitsubishi XFORCE.,1nserttranstv,48890883,informasi selebriti,Mitsubishi,0,943645,267,192465,0,NULL,NULL,NULL,https://twitter.com/1nserttranstv/status/1774028802638705015,https://pbs.twimg.com/profile_images/1272419525346988032/reQfjSLk_200x200.jpg
1753,March-24,1.77403E+18,Tetap kenyang di perjalanan mudik dengan resep bekal praktis ini! THREAD #Suzuki #SuzukiIndonesia #SuzukiTeManBerkendara #YourGearTranslate post,SuzukiIndonesia,214823582,Official Suzuki Indonesia,Suzuki,1,56311,35,34618,1,NULL,NULL,NULL,https://twitter.com/SuzukiIndonesia/status/1774028906603131021,https://pbs.twimg.com/profile_images/1670997078397558784/H9lEhaOq_200x200.jpg
1755,March-24,1.77403E+18,"Salad buah yang segar~ Potong buah-buahan segar seperti semangka, melon, anggur, dan stroberi. Campur dengan sedikit perasan jeruk nipis dan madu untuk rasa manis alami. Sajikan dalam kotak...",SuzukiIndonesia,214823582,Official Suzuki Indonesia,Suzuki,0,56323,35,34618,0,NULL,NULL,NULL,https://twitter.com/SuzukiIndonesia/status/1774028915318956443,https://pbs.twimg.com/profile_images/1670997078397558784/H9lEhaOq_200x200.jpg
1752,March-24,1.77403E+18,"Pastikan kendaraan Suzuki kamu selalu dalam kondisi prima dan aman dengan kunjungi Suzuki Bengkel Siaga! ? Suzuki Bengkel Siaga melayani segala kebutuhan service mulai dari penggantian oli,...",SuzukiIndonesia,214823582,Official Suzuki Indonesia,Suzuki,0,56323,35,34618,0,NULL,NULL,NULL,https://twitter.com/SuzukiIndonesia/status/1774029038757232769,https://pbs.twimg.com/amplify_video_thumb/1774028964866224128/img/qJNGxKAaypLGF6-V.jpg:large
1750,March-24,1.77404E+18,Selamat Hari Film Nasional Sahabat! Terus dukung dan cintai industri perfilman Indonesia untuk dapat menginspirasi siapa pun. Semoga semangat kreativitas terus berkobar di dunia perfilman tanah...,DaihatsuInd,86864472,Daihatsu Indonesia,Daihatsu,5,234353,10936,53206,5,NULL,NULL,NULL,https://twitter.com/DaihatsuInd/status/1774035775535104504,https://pbs.twimg.com/ext_tw_video_thumb/1774035752357437441/pu/img/7kCruXJA-p555_l3.jpg:large
1756,March-24,1.77406E+18,Daftar Harga Mobil Suzuki APV Arena BekasTranslate post,otosia,117686358,Otosia,Suzuki,0,20704,72,112230,0,NULL,NULL,NULL,https://twitter.com/otosia/status/1774063291616428095,https://pbs.twimg.com/profile_images/1737640462323007488/UWB34lxg_200x200.jpg
