id_,created_at,tweetID,tweet,username,id_str,name,entity,commentcount,likes,retweets,quotes,replies,sentiment,bidang,gender,link,imageUrl
1183,January-24,1.74782E+18,"Siapa yang sudah tidak sabar menyaksikan langsung Daihatsu Indonesia Masters 2024 yang akan bergulir pekan depan? Nah buat kalian yang mau #NgIstora dan sudah membeli tiket secara online, ini...",INABadminton,1200006384,BADMINTON INDONESIA,Daihatsu,114,1533127,209,76021,114,NULL,NULL,NULL,https://twitter.com/INABadminton/status/1747816445189501038,https://pbs.twimg.com/media/GEF9vHqboAAKBy6.jpg:large
1185,January-24,1.74784E+18,"Kirim Mobil Honda Brio dari Gresik tujuan ke Amurang Minahasa Selatan dengan kapal roro dan driving estimasi pengiriman 1 minggu. Ekspedisi Pengiriman Mobil FARHIYAtrans. Kirim mobil, truk,...",FarhiyaTrans,1.30685E+18,Farhiya Trans,Honda,0,47,10,1349,0,NULL,NULL,NULL,https://twitter.com/FarhiyaTrans/status/1747843585905705375,https://pbs.twimg.com/ext_tw_video_thumb/1747842979279310849/pu/img/S0tMT4z4EkRNTpJ7.jpg:large
1187,January-24,1.7479E+18,Berencana bepergian dalam waktu dekat? Ayo gunakan layanan City Check-In Lounge dari Hyundai Indonesia & Garuda Indonesia! Ikuti langkah mudahnya & rasakan kenyamanan perjalanan menuju bandara...,myHyundai_id,1.4312E+18,myhyundai.id,Hyundai,1,61,1,462,1,NULL,NULL,NULL,https://twitter.com/myHyundai_id/status/1747895531677114708,https://pbs.twimg.com/media/GEHFgyMa8AAg4Gu.jpg:large
1189,January-24,1.74793E+18,gak pulang kerumah 4 bulan tbtb bokap gue beli mobil wuling yg kecil 2 BIJI BUAT DIA SM PAK RW????Translate post,cryingfairies,3349205338,✨,Wuling,52,31,95,1990,52,NULL,NULL,NULL,https://twitter.com/cryingfairies/status/1747925784273297586,https://pbs.twimg.com/profile_images/1746162707240480768/tKMjwAty_200x200.jpg
687,January-24,1.74793E+18,Dukungan untuk pembangunan di Papua mencerminkan komitmen kita pada persatuan #KitongDukungOtsus,putri_najmahh,1.5779E+18,putri najmah,Toyota,0,NULL,NULL,NULL,16,NULL,NULL,NULL,https://twitter.com/putri_najmahh,undefined:large
1186,January-24,1.74794E+18,kecelakaan lalu lintas itu terjadi antara sepeda motor Yamaha Mio M3 G 5362 HAA yang dikendarai RF bersama temannya SO dengan mobil Honda Jazz BG 1734 EM milik AR. #publisherstory #urbanidTranslate...,kumparan,7.59693E+17,kumparan,Honda,0,1080522,3,1081527,0,NULL,NULL,NULL,https://twitter.com/kumparan/status/1747944320400036064,https://pbs.twimg.com/profile_images/1777904276129624064/YWurU1PS_200x200.jpg
974,January-24,1.74799E+18,"Wow, di sini ada video yang sangat menarik! Hiburan dulu gass sikat ges https://s.snackvideo.com/p/ruHdkdqi",muhammdaminrais,144790159,Muhammad Amin Rais,Daihatsu,0,NULL,NULL,NULL,0,NULL,NULL,NULL,https://twitter.com/muhammdaminrais,https://pbs.twimg.com/profile_images/533472417234972672/JkENr0wq_200x200.jpeg
115,January-24,1.74813E+18,Mitsubishi Bali Terima kasih Pak Agus utk pembelian Mitsubishi Canter FE 75 SHDX Semoga usahanya makin sukses Promo DP 30 juta saja Silahkan hub marketing 081239977241,Aryantoberimau,7.58218E+17,Aryanto Mitsubishi Bali,Mitsubishi,0,NULL,NULL,NULL,1,NULL,NULL,NULL,https://twitter.com/Aryantoberimau,https://pbs.twimg.com/media/GEKfEiJawAAdcZA.jpg:large
1191,January-24,1.74818E+18,Selalu tanamkan pedoman “pelan-pelan pak supir” Karena yang tercinta menunggu Sahabat di rumah ?Translate post,DaihatsuInd,86864472,Daihatsu Indonesia,Daihatsu,5,235268,10954,52703,5,NULL,NULL,NULL,https://twitter.com/DaihatsuInd/status/1748178477038108723,https://pbs.twimg.com/profile_images/1447891799842779143/9fHut2AP_200x200.jpg
1192,January-24,1.74827E+18,"Longsor yang terjadi di Boyolali, Jawa Tengah pada Jumat (19/1/2024) membuat lima kendaraan terjebak, dua diantaranya ikute terseret. Meski terseret longsor, namun pengemudi mobil tersebut...",tribunnews,124171593,Tribunnews.com,Mitsubishi,0,1461189,536,908951,0,NULL,NULL,NULL,https://twitter.com/tribunnews/status/1748266103929995366,https://pbs.twimg.com/profile_images/1762763607266467840/GZ_9FZDF_200x200.jpg
1190,January-24,1.7483E+18,"Pengennya sih agresif dan produktif, sat set sat set. Tapi apa daya, realita berkata lain. Setuju gak Toyota Friends? #ToyotaAfterHoursTranslate post",ToyotaID,64310527,Toyota Indonesia,Toyota,6,182537,18732,50849,6,NULL,NULL,NULL,https://twitter.com/ToyotaID/status/1748299261597335718,https://pbs.twimg.com/media/GEMpnMBbEAAHb0R.jpg:large
1195,January-24,1.74858E+18,"Tabel Simulasi Kredit Syariah Hyundai IONIQ 5 Januari 2024, Cicilan Rp8 Jutaan Anti RibaTranslate post",pikiran_rakyat,58880688,Pikiran Rakyat,Hyundai,0,469459,106,536721,0,NULL,NULL,NULL,https://twitter.com/pikiran_rakyat/status/1748578235624120544,https://pbs.twimg.com/profile_images/1722449854868451328/kNa3NJi3_200x200.jpg
1194,January-24,1.7486E+18,"Kecelakaan maut terjadi di Jalan Ahmad Yani, Kilometer 29, Kecamatan Landasan Ulin, Banjarbaru, Kalimantan Selatan (Kalsel) pada Kamis (18/1/2024), antara mobil Toyota Fortuner dan sebuah bus...",baperanewscom,1.60873E+18,Bapera News,Toyota,1,1117,36,10049,1,NULL,NULL,NULL,https://twitter.com/baperanewscom/status/1748596438156837147,https://pbs.twimg.com/profile_images/1608725525606072321/aEsTpkps_200x200.jpg
395,January-24,1.74871E+18,"#WulingQuiz Seberapa jeli Anda bisa menebak mobil-mobil Wuling di balik tirai ini dengan benar untuk memenangkan hadiah saldo e-wallet total senilai Indrie (@_Indrie_) on X Hidup akan penuh warna jika kamu selalu tersenyum dalam menjalankan hari harimu ^^                           wechat: Indrie_",_Indrie_,483107570,Indrie,Wuling,NULL,NULL,NULL,NULL,322,NULL,NULL,NULL,https://twitter.com/_Indrie_,https://pbs.twimg.com/profile_images/624052723558715392/7jONMVCP_200x200.jpg
1196,January-24,1.74897E+18,Berikut kisaran harga mobil Honda Jazz bekas yang masih banyak diminati konsumen.Translate post,kompascom,23343960,Kompas.com,Honda,0,8631712,29,2535167,0,NULL,NULL,NULL,https://twitter.com/kompascom/status/1748974350806749531,https://pbs.twimg.com/profile_images/1577144849437888514/d9x3nKN8_200x200.jpg
1198,January-24,1.74903E+18,Rekomendasi mobil kalcer buat kamu yang mau tampil beda disetiap aktivitas kamu! #Suzuki #SuzukiIndonesia #SuzukiTeManBerkendara #YourGearTranslate post,SuzukiIndonesia,214823582,Official Suzuki Indonesia,Suzuki,1,56291,34,34850,1,NULL,NULL,NULL,https://twitter.com/SuzukiIndonesia/status/1749025243354816581,https://pbs.twimg.com/media/GEXJLlMaQAE6TLI.jpg:large
1197,January-24,1.74903E+18,"Bikin kamu nyaman~ Fitur-fitur interiornya udah pasti bikin kamu merasa aman dan nyaman. Emang yang bikin nyaman gak bakal ada lawan, setuju gak Suzuki Family?Translate post",SuzukiIndonesia,214823582,Official Suzuki Indonesia,Suzuki,1,56167,35,34457,1,NULL,NULL,NULL,https://twitter.com/SuzukiIndonesia/status/1749026933478916362,https://pbs.twimg.com/profile_images/1670997078397558784/H9lEhaOq_200x200.jpg
968,January-24,1.74909E+18,@NarasiNewsroom. ·. Jan 1. Duh terus gimana ya mobil Daihatsu dan Toyota di Indonesia? Tonton sampai habis deh coba | Narasi Daily. Embedded video. 1:30. Martin (@MartinFanany) on X The kopites. You'll Never Walk Alone.,MartinFanany,178648913,Martin,Daihatsu,NULL,NULL,NULL,NULL,63,NULL,NULL,NULL,https://twitter.com/MartinFanany,https://pbs.twimg.com/profile_images/1457327002881462274/G-8nBD3C_200x200.jpg
1533,January-24,1.74927E+18,Cuma ngetwit di hari kerja🫰,boledcool,74405623,Bang,Daihatsu,0,NULL,NULL,NULL,5090,NULL,NULL,NULL,https://twitter.com/boledcool,https://pbs.twimg.com/profile_images/1242939297939906560/j0qhTu-O_200x200.jpg
542,January-24,1.74928E+18,"13. 32. 126. 4K · K451Π® · @Kasino780462241. ·. Mar 18, 2023. Semoga cepat open mainet agar mobil Hyundai impian bisa terwujud. Quote. abner_tindi · @ (@) on X Hi tweps..., Setelah Menyaksikan
Debat Capres/Cawapes Sesi ke IV
Minggu 21 Januari 2024
~
Maka Pilihan Anda Untuk Presiden 2024 Adalah  Pasangan.. ? ?
~
Biar Tidak Disangka Bot, Setelah Vote Silahkan
Retwet ? Like ❤️Coment ✍️",Kasino780462241,1.45939E+18,K451Π®,Hyundai,NULL,NULL,NULL,NULL,2124,NULL,NULL,NULL,https://twitter.com/Kasino780462241,undefined:large
1199,January-24,1.74934E+18,"Anggota Kepolisian Resor Sabu Raijua, Nusa Tenggara Timur (NTT), Darius Gasa (39) menabrak seorang pelajar bernama Mike Tyson Name hingga terluka parah dan meninggal dunia. “Kejadiannya hari...",RadioElshinta,121640063,Radio Elshinta,Toyota,1,3695043,11,1476861,1,NULL,NULL,NULL,https://twitter.com/RadioElshinta/status/1749335789992054785,https://pbs.twimg.com/media/GEbjm30bkAAo3TX.jpg:large
1205,January-24,1.74935E+18,Indonesia Masters 2024 Digelar di Istora 23-28 Januari https://beritasatu.com/sport/2795506/indonesia-masters-2024-digelar-di-istora-23-28-januari?utm_source=dlvr.it&utm_medium=twitter… #beritasa...,Beritasatu,154102750,BeritaSatu,Daihatsu,0,1078926,221,1083006,0,NULL,NULL,NULL,https://twitter.com/Beritasatu/status/1749346229207916590,https://pbs.twimg.com/profile_images/1670400265743376385/nUdqmHBU_200x200.jpg
1203,January-24,1.74936E+18,Konferensi pers dan doa bersama para panitia pelaksana menandai awal digelarnya turnamen bulutangkis Daihatsu Indonesia Masters 2024. (PART1) #BadmintonIndonesia #DIM2024 #DaihatsuIndonesiaMasters2...,INABadminton,1200006384,BADMINTON INDONESIA,Daihatsu,10,1532750,209,76119,10,NULL,NULL,NULL,https://twitter.com/INABadminton/status/1749355417329881449,https://pbs.twimg.com/media/GEb1eBga4AAk2Jk.jpg:large
1204,January-24,1.74936E+18,"Besok, 278 Pebulu Tangkis Siap Tempur di Indonesia Masters 2024 https://beritasatu.com/sport/2795512/besok-278-pebulu-tangkis-siap-tempur-di-indonesia-masters-2024?utm_source=dlvr.it&utm_medium=twi...",Beritasatu,154102750,BeritaSatu,Daihatsu,0,1078906,221,1083095,0,NULL,NULL,NULL,https://twitter.com/Beritasatu/status/1749355881396125912,https://pbs.twimg.com/profile_images/1670400265743376385/nUdqmHBU_200x200.jpg
1202,January-24,1.74939E+18,"Chico dan Apri/Fadia kembali, Ester dan Jafar/Aisyah mendapat kesempatan berlaga. Sementara, The Daddies masih harus absen karena Ahsan dalam proses pemulihan cedera. Berikut skuad Merah-Putih...",INABadminton,1200006384,BADMINTON INDONESIA,Daihatsu,108,1533542,209,75837,108,NULL,NULL,NULL,https://twitter.com/INABadminton/status/1749389169858875823,https://pbs.twimg.com/media/GEcUK5OagAApvJV.jpg:large
1206,January-24,1.7494E+18,"Sabun juga perlu diperhatiin! Masa mobil udah cakep-cakep, nyucinya pake sabun cuci piring??Translate post",SuzukiIndonesia,214823582,Official Suzuki Indonesia,Suzuki,2,56144,35,34488,2,NULL,NULL,NULL,https://twitter.com/SuzukiIndonesia/status/1749404188042526966,https://pbs.twimg.com/profile_images/1670997078397558784/H9lEhaOq_200x200.jpg
1201,January-24,1.74946E+18,Inilah hasil undian terbaru Daihatsu Indonesia Masters 2024 setelah Manager's meeting hari ini. Semangat Indonesia ?? #DIM2024 @BNI46 #BNIGlobalReachIndonesianPrideTranslate post,INABadminton,1200006384,BADMINTON INDONESIA,Daihatsu,31,1532958,209,76104,31,NULL,NULL,NULL,https://twitter.com/INABadminton/status/1749460719459008674,https://pbs.twimg.com/media/GEdVD-rasAEugkT.jpg:large
1200,January-24,1.74946E+18,Hari pertama Daihatsu Indonesia Masters 2024 bergulir mulai Selasa (22/1) besok. Memainkan babak kualifikasi semua sektor dan babak 32 besar ganda putra-putri. Berikut jadwal pemain-pemain...,INABadminton,1200006384,BADMINTON INDONESIA,Daihatsu,20,1533037,209,76080,20,NULL,NULL,NULL,https://twitter.com/INABadminton/status/1749461497259172054,https://pbs.twimg.com/media/GEdV8ZEbkAAyM02.jpg:large
920,January-24,1.74952E+18,"Ia terlindas mobil Mitsubishi Pajero ketika sedang bermain di depan rumahnya di Jalan Adyaksa, Kecamatan Panakukkang, Makassar, Sulawesi Selatan. Embedded (@) on X @cholilnafis Apakah kyai sebagai sebagai pribadi tidak mau memberikan imbauan untuk pilpres nanti.
Ada calon yang sangat mengakhawatir menurut saya kyai yang mana mereka sekarang lagi bernafsu banget untuk meraih singgasana, dan sebagian rakyatpun mulai terpesona oleh gimmicknya?",Andrea57841777,8.28084E+17,Andrea,Mitsubishi,NULL,NULL,NULL,NULL,51,NULL,NULL,NULL,https://twitter.com/Andrea57841777,undefined:large
1208,January-24,1.74963E+18,nonton bulutangkis internasional daihatsu indonesia masters 2024 selesa minggu 23/28 januari 2024 di istora gelora bung karno tanah abang jakarta pusat live hanya di tv gratis : mnctv dan inews...,arifky87,2589490099,AKBAR RIFKY,Daihatsu,0,473,19,21143,0,NULL,NULL,NULL,https://twitter.com/arifky87/status/1749631962111979575,https://pbs.twimg.com/media/GEfw_yubEAA3w2e.jpg:large
476,January-24,1.74964E+18,"WTS 1 tiket Daihatsu Indonesia Master 2024, VIP Day 4. Karena teman nggak jadi nonton. Tiket pribadi, bukan harga calo. Ketemuan di venue udah jadi wristband.",geoahmad,82123406,Geovani Ardy Ahmad,Daihatsu,5,NULL,NULL,NULL,5,NULL,NULL,NULL,https://twitter.com/geoahmad,https://pbs.twimg.com/profile_images/1471304893382021122/zZQHpZsy_200x200.jpg
1211,January-24,1.7497E+18,Daftar Mobil Honda Paling Dicari Orang Indonesia Selama 2023 http://dlvr.it/T1lVjY #RamadanTranslate post,VIVAcoid,41730943,VivaCoid,Honda,0,4748622,11,1768048,0,NULL,NULL,NULL,https://twitter.com/VIVAcoid/status/1749703811055386985,https://pbs.twimg.com/media/GEgyWCNa4AAHMvJ.jpg:large
1210,January-24,1.7497E+18,Ester mengaku senang dengan hasil yang diraih mengingat saat menjalani debut tunggal putri ranking 50 dunia itu bisa ke babak utamaTranslate post,mediaindonesia,68930552,Media Indonesia,Daihatsu,0,1771668,81,878293,0,NULL,NULL,NULL,https://twitter.com/mediaindonesia/status/1749703894006210935,https://pbs.twimg.com/profile_images/1743523592569229312/Am6sPQip_200x200.jpg
1207,January-24,1.74977E+18,Tebak nomor berapa shuttlecock yang tepat dan dapatkan tiket gratis Daihatsu Indonesia Masters 2024! Caranya gampang banget: 1. Follow semua platform sosial media Daihatsu Indonesia 2. Like...,DaihatsuInd,86864472,Daihatsu Indonesia,Daihatsu,779,234544,10936,53188,779,NULL,NULL,NULL,https://twitter.com/DaihatsuInd/status/1749766813351846342,https://pbs.twimg.com/media/GEhrpACaQAA_tZC.jpg:large
1209,January-24,1.74984E+18,? JADWAL PERTANDINGAN! Sebanyak 11 wakil Indonesia akan bertanding di babak 32 Besar Daihatsu Indonesia Masters 2024 besok. Pertandingan dengan level BWF Tour Super 500 ini akan di mulai...,INABadminton,1200006384,BADMINTON INDONESIA,Daihatsu,12,1533408,209,75943,12,NULL,NULL,NULL,https://twitter.com/INABadminton/status/1749840291794923642,https://pbs.twimg.com/media/GEiudvNa0AMDNSN.jpg:large
1218,January-24,1.74996E+18,Suzuki Indonesia Kejar Reduksi Karbon di Pabrik https://otomotif.tempo.co/read/1825088/suzuki-indonesia-kejar-reduksi-karbon-di-pabrik?utm_source=Twitter&utm_medium=dlvr.it… #TempoOtomotifTransla...,tempodotco,18129942,tempo.co,Suzuki,0,2240585,29,1291544,0,NULL,NULL,NULL,https://twitter.com/tempodotco/status/1749955194291691581,https://pbs.twimg.com/profile_images/1580466468629594112/Q-zcV6aQ_200x200.jpg
1213,January-24,1.75002E+18,Indonesia Master 2024: Apriyani/Fadia Terhenti di Babak 32 BesarTranslate post,tvOneNews,55507370,tvOnenews,Daihatsu,0,9877859,50,454321,0,NULL,NULL,NULL,https://twitter.com/tvOneNews/status/1750021907439886567,https://pbs.twimg.com/profile_images/1720666390380843008/nYKt5ab9_200x200.jpg
1215,January-24,1.75007E+18,"Putri menang atas wakil Malaysia, Karupathevan Letshanaa dengan skor 21-17, 21-12 dalam pertandingan yang digelar di Istora Gelora Bung Karno, Senayan, Jakarta, Rabu (24/1).Translate post",mediaindonesia,68930552,Media Indonesia,Daihatsu,0,1771571,81,878391,0,NULL,NULL,NULL,https://twitter.com/mediaindonesia/status/1750065383435014154,https://pbs.twimg.com/profile_images/1743523592569229312/Am6sPQip_200x200.jpg
1219,January-24,1.75008E+18,"Buat kamu yang suka kirim paket, mending cobain kirim paket di aplikasi J&T Express karena kamu bisa dapet kesempatan tambahan untuk main 'Buka Paket' di Aplikasi J&T dan dapetin mobil Wuling...",jntexpressid,3253429832,J&T Express Indonesia,Wuling,8,161188,8,113756,8,NULL,NULL,NULL,https://twitter.com/jntexpressid/status/1750081073646854521,https://pbs.twimg.com/ext_tw_video_thumb/1750080052392570880/pu/img/17UUHP5mXdoFq1la.jpg:large
1216,January-24,1.7501E+18,4 Mobil Hyundai Ini Akan Diluncurkan Sepanjang 2024Translate post,IDNTimes,388190238,IDN Times,Hyundai,0,401350,297,1177508,0,NULL,NULL,NULL,https://twitter.com/IDNTimes/status/1750099651116904608,https://pbs.twimg.com/profile_images/1724291491164717056/4eicKfLo_200x200.jpg
1214,January-24,1.75011E+18,"Pith mengaku percaya diri seusai tampil di hadapan publik Istora Senayan. Apalagi, bermain di hadapan pendukung tuan rumah yang memadati Istora Gelora Bung Karno, Jakarta.Translate post",mediaindonesia,68930552,Media Indonesia,Daihatsu,0,1771132,81,878211,0,NULL,NULL,NULL,https://twitter.com/mediaindonesia/status/1750105257034793344,https://pbs.twimg.com/profile_images/1743523592569229312/Am6sPQip_200x200.jpg
1217,January-24,1.75011E+18,"Bukan cuma buat gaya, sunroof juga ada fungsinya! THREAD #Suzuki #SuzukiIndonesia #SuzukiTeManBerkendara #YourGear",SuzukiIndonesia,214823582,Official Suzuki Indonesia,Suzuki,13,55933,35,34203,13,NULL,NULL,NULL,https://twitter.com/SuzukiIndonesia/status/1750109152440119679,https://pbs.twimg.com/media/GEmi_hmb0AAT5vx.jpg:large
1212,January-24,1.75021E+18,Perjuangan berlanjut ke babak 16 besar Daihatsu Indonesia Masters 2024. Pertandingan digelar hari Kamis (25/1) mulai pukul 10.00 WIB. Berikut jadwal pemain-pemain Indonesia. Semangat! #DIM2024...,INABadminton,1200006384,BADMINTON INDONESIA,Daihatsu,9,1532657,209,76095,9,NULL,NULL,NULL,https://twitter.com/INABadminton/status/1750208608401547683,https://pbs.twimg.com/media/GEn8z3ca4AM-O0f.jpg:large
1223,January-24,1.7504E+18,"Yuk, segera miliki Wuling Air ev untuk kemudahan bermobilitas! Untuk info lengkap klik http://bit.ly/AIREV_TW! #WulingMotors #DriveForABetterLife #Airev #DriveForAGreenLifeTranslate post",WulingMotorsID,7.57798E+17,WulingMotorsID,Wuling,0,35855,205,12048,0,NULL,NULL,NULL,https://twitter.com/WulingMotorsID/status/1750403288527519814,https://pbs.twimg.com/profile_images/1539128369698177028/ALzAgMqw_200x200.jpg
1222,January-24,1.75048E+18,Upaya Suzuki Menerapkan Proses Produksi Rendah Karbon https://jpnn.com/news/upaya-suzuki-menerapkan-proses-produksi-rendah-karbon… #SuzukiTranslate post,jpnncom,79130206,JPNN.com,Suzuki,0,69002,0,981971,0,NULL,NULL,NULL,https://twitter.com/jpnncom/status/1750480868953694310,https://pbs.twimg.com/profile_images/1523518470499205121/EJf01gIy_200x200.jpg
1221,January-24,1.75053E+18,Hasil 16 Besar Indonesia Masters 2024 Hari Ini: 8 Wakil Tuan Rumah Lolos ke Babak Perempat FinalTranslate post,pikiran_rakyat,58880688,Pikiran Rakyat,Daihatsu,0,470935,106,539761,0,NULL,NULL,NULL,https://twitter.com/pikiran_rakyat/status/1750534768998093145,https://pbs.twimg.com/profile_images/1722449854868451328/kNa3NJi3_200x200.jpg
1220,January-24,1.75055E+18,Delapan wakil Indonesia berlaga di babak perempatfinal Daihatsu Indonesia Masters 2024. Satu tempat di semifinal ganda putra sudah dimiliki Fajar/Rian atau Bagas/Fikri. Besok Jumat (26/1) mulai...,INABadminton,1200006384,BADMINTON INDONESIA,Daihatsu,25,1530368,209,75729,25,NULL,NULL,NULL,https://twitter.com/INABadminton/status/1750551090574266388,https://pbs.twimg.com/media/GEs07ksa4AAg2MB.jpg:large
1028,January-24,1.75073E+18,"? #Snowman (SNOW), koin meme resmi dari @ice_blockchain, dirilis sebagai peluncuran adil di #Uniswap Perdagangkan Sekarang: https://dexscreener.com/ethereum/0xd1f3d2f5c12a205fc912358878b089eae48...",fnanang,303025012,ZonaBarangIlang,Daihatsu,0,NULL,NULL,NULL,181544,NULL,NULL,NULL,https://twitter.com/fnanang,https://pbs.twimg.com/profile_images/1156861296756662272/FB3e5VcG_200x200.jpg
1230,January-24,1.75074E+18,"Kirim mobil Mitsubishi Xpander dari Sragen tujuan ke Balikpapan dgn kapal roro dan driving estimasi pengiriman 3-4 hari. Ekspedisi Pengiriman Mobil FARHIYAtrans. Kirim mobil, truk, sepeda motor,...",FarhiyaTrans,1.30685E+18,Farhiya Trans,Mitsubishi,0,48,10,1336,0,NULL,NULL,NULL,https://twitter.com/FarhiyaTrans/status/1750735469988761785,https://pbs.twimg.com/ext_tw_video_thumb/1750735283610701824/pu/img/opKiAFJlg-0bfqPF.jpg:large
429,January-24,1.75075E+18,BOOKED,mintaelix,1.14428E+18,95✨,Daihatsu,0,NULL,NULL,NULL,7,NULL,NULL,NULL,https://twitter.com/mintaelix,https://pbs.twimg.com/profile_images/1544032212563406848/sHs2CDf5_200x200.jpg
1229,January-24,1.75085E+18,Alhamdulillah main hari sabtu lagi Jri? bisa yuk sampe hari mingguTranslate post,chocoathlete,1.11165E+18,c.,Daihatsu,0,731,201,10976,0,NULL,NULL,NULL,https://twitter.com/chocoathlete/status/1750853737399357765,https://pbs.twimg.com/profile_images/1662866682204024832/yy4WFRwg_200x200.jpg
1227,January-24,1.7509E+18,"Hari kelima turnamen badminton Daihatsu Indonesia Masters 2024 merupakan jadwal babak semifinal. Jadwal babak semifinal Indonesia Masters 2024 dimulai pada hari Sabtu, 27 Januari 2024 Pukul...",bhulukhuduktv,1.30517E+18,Bhulukhuduk TV,Daihatsu,3,151166,114,146574,3,NULL,NULL,NULL,https://twitter.com/bhulukhuduktv/status/1750904522816589836,https://pbs.twimg.com/media/GEx2YnIbgAAwYnW.jpg:large
1228,January-24,1.75091E+18,"Empat wakil di semifinal, satu sudah pastikan tiket laga puncak. Ini jadwal pemain-pemain Merah-Putih di Daihatsu Indonesia Masters 2024 besok. Mulai pukul 13.00 WIB di Istora Senayan, GBK,...",INABadminton,1200006384,BADMINTON INDONESIA,Daihatsu,31,1530901,209,75745,31,NULL,NULL,NULL,https://twitter.com/INABadminton/status/1750907968336666900,https://pbs.twimg.com/media/GEx5fjaa8AAB4T5.jpg:large
1224,January-24,1.75093E+18,"Warning! Kalau Sahabat Daihatsu ngerasain tanda-tanda ini saat berkendara, mending istirahat dulu ya biar gak ngebahayain diri sendiri #DaihatsuSahabatkuTranslate post",DaihatsuInd,86864472,Daihatsu Indonesia,Daihatsu,1,234470,10935,53211,1,NULL,NULL,NULL,https://twitter.com/DaihatsuInd/status/1750926574877339976,https://pbs.twimg.com/media/GEaTcimbAAA_GAp.png:large
1225,January-24,1.75093E+18,Siapa yang udah nyiapin rencana liburan bareng keluarga? Sebelum berangkat jangan lupa ikuti tips dari Daimin ya. #DaihatsuSahabatkuTranslate post,DaihatsuInd,86864472,Daihatsu Indonesia,Daihatsu,8,234557,10936,53198,8,NULL,NULL,NULL,https://twitter.com/DaihatsuInd/status/1750926576198517138,https://pbs.twimg.com/media/GEJY_PWbAAI90EU.png:large
1226,January-24,1.75093E+18,"Ada cerita di balik M Bloc Space, tempat tongkrongan hits anak Jakarta! Daimin suka maen juga di M Bloc Space, tapi baru tau sejarahnya di sini:Translate post",DaihatsuInd,86864472,Daihatsu Indonesia,Daihatsu,0,234410,10936,53198,0,NULL,NULL,NULL,https://twitter.com/DaihatsuInd/status/1750926581478916535,https://pbs.twimg.com/profile_images/1447891799842779143/9fHut2AP_200x200.jpg
1050,January-24,1.75096E+18,"? #Snowman (SNOW), koin meme resmi dari @ice_blockchain, dirilis sebagai peluncuran adil di #Uniswap Perdagangkan Sekarang: https://dexscreener.com/ethereum/0xd1f3d2f5c12a205fc912358878b089eae48...",TurboYunus,1.47619E+18,Turbo Muhammad Yunus,Honda,0,NULL,NULL,NULL,2,NULL,NULL,NULL,https://twitter.com/TurboYunus,https://pbs.twimg.com/profile_images/1490603712586612737/JlBHBd8w_200x200.jpg
1237,January-24,1.75104E+18,"Data Lengkap Penjualan Mobil Honda Tahun 2023, Ini Produk TerlarisTranslate post",nusantara62,1.48732E+18,nusantara62 redaksi,Honda,0,11,192,4298,0,NULL,NULL,NULL,https://twitter.com/nusantara62/status/1751036256874889648,https://pbs.twimg.com/profile_images/1487316717093023746/2t6DESx-_200x200.jpg
945,January-24,1.75112E+18,Syarat RT tweet ini dan reply berapa wakil Indonesia di semifinal Daihatsu Indonesia Masters 2024. Diundi besok sore sebelum Indonesia vs Australia. 120. 100. Upi Ipi (@ipi_upi) on X In my life,ipi_upi,1.54246E+18,Upi Ipi,Daihatsu,NULL,NULL,NULL,NULL,120,NULL,NULL,NULL,https://twitter.com/ipi_upi,https://pbs.twimg.com/profile_images/1542464542273576961/qF5CzcND_200x200.png
1233,January-24,1.75114E+18,Pernyataan resmi panitia pelaksana perihal penundaan pertandingan semifinal Daihatsu Indonesia Masters 2024. Kami memohon maaf atas kejadian ini dan selamat kembali menyaksikan babak semifinal...,INABadminton,1200006384,BADMINTON INDONESIA,Daihatsu,53,1533494,209,75837,53,NULL,NULL,NULL,https://twitter.com/INABadminton/status/1751139927641948447,https://pbs.twimg.com/media/GE1MeSbaEAA0A1B.jpg:large
1235,January-24,1.75115E+18,... Kami memohon maaf atas apa yang terjadi hari ini dan selamat kembali menikmati babak semifinal Daihatsu Indonesia Masters 2024.Translate post,firzieidris,28201831,Firzie A. Idris,Daihatsu,0,9281,1944,53338,0,NULL,NULL,NULL,https://twitter.com/firzieidris/status/1751148105951797499,https://pbs.twimg.com/profile_images/1715058947655380992/UjEjKHRB_200x200.jpg
1234,January-24,1.75116E+18,"Apa kabar Kevin Sanjaya? Yuk cari tahu dari video ini. Ia kemarin mampir di Istora untuk meet n greet, menyapa rekan-rekan pelatnas hingga menonton pertandingan Daihatsu Indonesia Masters 2024....",INABadminton,1200006384,BADMINTON INDONESIA,Daihatsu,15,1533385,209,75837,15,NULL,NULL,NULL,https://twitter.com/INABadminton/status/1751163027905483034,https://pbs.twimg.com/amplify_video_thumb/1751161084126572544/img/8H9HQ_S_6cFNudOc.jpg:large
1029,January-24,1.75117E+18,Ayoo @Miduk17 jgn ngumpet aja,Black85131249,1.5541E+18,Black,Daihatsu,0,NULL,NULL,NULL,1139,NULL,NULL,NULL,https://twitter.com/black85131249,https://pbs.twimg.com/ext_tw_video_thumb/1751114039227506688/pu/img/E4pCMFSAEMtgj0qc.jpg:large
1238,January-24,1.7512E+18,Terhindar dari timbulnya waterpot~ Air hujan yang menempel di bodi mobil akan turun dan tidak menyentuh permukaan cat terlalu lama. Sehingga permukaannya tidak akan muncul noda yang susah dihilangk...,SuzukiIndonesia,214823582,Official Suzuki Indonesia,Suzuki,1,56160,35,34457,1,NULL,NULL,NULL,https://twitter.com/SuzukiIndonesia/status/1751197725306339504,https://pbs.twimg.com/profile_images/1670997078397558784/H9lEhaOq_200x200.jpg
